{
    "$schema": "http://json-schema.org/draft-04/schema#", 
    "id": "https://github.com/bspies/ainur/config.schema.json",
    "type": "object",
    "properties": {
        "root": {
            "type": "string"
        },
        "features": {
            "type": "array",
            "items": {"type": "string"}
        },
        "output": {
            "type": "object",
            "properties": {
                "bundles": {
                    "type": "object"
                },
                "html": {
                    "type": "array"
                }
            }
        },
        "source": {
            "type": "object",
            "properties": {
                "excludes" : {
                    "oneOf":[
                        { "type": "string" },
                        { "type": "array", "items": {"type": "string"} }
                    ]
                },
                "level": {
                    "type": "string"
                },
                "lint": {
                    "type": "boolean"
                },
                "maps": {
                    "type": "string"
                }
            }
        },
        "targets": {
            "type": "object",
            "oneOf":[
                {
                    "properties": {
                        "browsers": {
                            "type": "array"
                        }
                    }
                },
                {
                    "properties": {
                        "node": {
                            "type": "string"
                        }
                    }
                }
            ]
        }
    }
}